Title,Link,Date
OverCoded,"Technologies: Gatsby, React, and GraphQL ",https://overcoded.netlify.com/
DevConnector,"Technologies: MongoDB, Express, React, Node.js ",https://stormy-waters-79672.herokuapp.com/
Weather Forecast in France,Technologies: React and Redux ,https://mighty-reef-87458.herokuapp.com/
React Application Unit Testing,Technologies: React and Jest ,
Isomorphic React,Technologies: React and Node.js ,https://isomorphic-react-x.herokuapp.com/
Docker and Node.js,"Technologies: Docker, Node.js, Express, MongoDB ",
Emaily,"Technologies: MongoDB, Express, React, Node.js ",https://ancient-thicket-18138.herokuapp.com/
LyricFinder,Technologies: React,https://fervent-morse-2d7639.netlify.com/
Personal Project Management Tool,Technologies: React and Spring (Java) ,https://frozen-island-29746.herokuapp.com/
Yelp Camp,"Technologies: MongoDB, Express.js, Node.js ",https://fathomless-brook-35887.herokuapp.com/
Contact Manager,Technologies: React,https://testardr.github.io/ContactManagerReact/#/
VidJot,"Technologies: MongoDB, Express.js, Node.js ",https://vast-refuge-14106.herokuapp.com/
The Typewriter Effect,Technologies: Javascript-ES6 ,https://codepen.io/testardr/pen/BqamyG
Learning Management System,Technologies: Javascript-ES5 ,./dist/project/LMS/index.html
